{
  "schemaVersion": "1.0.0",
  "frameworkId": "ncom",
  "sourceCommit": "a350b576bbeae6c6254273037a17d2a8730fb80f",
  "generatedAt": "2026-07-28T03:27:49.485Z",
  "coverage": {
    "publicComponents": 57,
    "coveredPublicComponents": 24,
    "publicSymbols": 157,
    "coveredPublicSymbols": 29,
    "currentPublishedUnits": 22,
    "reviewedFamilies": 3
  },
  "gaps": [
    {
      "id": "gap-component-component-09c7b8e4e89a5ecd",
      "type": "uncovered_component_api",
      "targetId": "component-09c7b8e4e89a5ecd",
      "targetName": "NCLayout component API",
      "packageId": "package-ncom-components",
      "currentKnowledgeIds": [],
      "reason": "public component has no current published component knowledge unit",
      "publicReachable": true,
      "documentationAvailable": true,
      "exampleAvailable": true,
      "structuralImportance": 3,
      "evidenceAvailability": 5,
      "estimatedLearningCost": 2,
      "reusePotential": 5,
      "recommendedTopicType": "component_api",
      "title": "NCLayout component API",
      "reasons": [
        "public component has no current published component knowledge unit"
      ],
      "retrievalCount": 0,
      "rawFallbackCount": 0,
      "snippetCount": 0,
      "taskCount": 0,
      "priorityScore": 36,
      "scoreBreakdown": {
        "taskHitFrequency": 0,
        "rawFallbackCount": 0,
        "publicApiImportance": 5,
        "reusableComponentCount": 5,
        "evidenceCompleteness": 5,
        "learningCostPenalty": 2,
        "unresolvedPenalty": 0,
        "lowConfidencePenalty": 0
      },
      "warnings": [
        "尚无任务级 demand 证据时，频率字段保持 0。"
      ],
      "dependencyCount": 3,
      "risk": 1
    },
    {
      "id": "gap-component-component-0bbbfda64ac8f3b0",
      "type": "uncovered_component_api",
      "targetId": "component-0bbbfda64ac8f3b0",
      "targetName": "NCRouter component API",
      "packageId": "package-ncom-components",
      "currentKnowledgeIds": [],
      "reason": "public component has no current published component knowledge unit",
      "publicReachable": true,
      "documentationAvailable": true,
      "exampleAvailable": false,
      "structuralImportance": 2,
      "evidenceAvailability": 4,
      "estimatedLearningCost": 2,
      "reusePotential": 1,
      "recommendedTopicType": "component_api",
      "title": "NCRouter component API",
      "reasons": [
        "public component has no current published component knowledge unit"
      ],
      "retrievalCount": 0,
      "rawFallbackCount": 0,
      "snippetCount": 0,
      "taskCount": 0,
      "priorityScore": 26,
      "scoreBreakdown": {
        "taskHitFrequency": 0,
        "rawFallbackCount": 0,
        "publicApiImportance": 5,
        "reusableComponentCount": 1,
        "evidenceCompleteness": 4,
        "learningCostPenalty": 2,
        "unresolvedPenalty": 0,
        "lowConfidencePenalty": 0
      },
      "warnings": [
        "尚无任务级 demand 证据时，频率字段保持 0。"
      ],
      "dependencyCount": 2,
      "risk": 1
    },
    {
      "id": "gap-component-component-1cc29c62f560e54e",
      "type": "uncovered_component_api",
      "targetId": "component-1cc29c62f560e54e",
      "targetName": "NCCalendar component API",
      "packageId": "package-ncom-components",
      "currentKnowledgeIds": [],
      "reason": "public component has no current published component knowledge unit",
      "publicReachable": true,
      "documentationAvailable": true,
      "exampleAvailable": true,
      "structuralImportance": 3,
      "evidenceAvailability": 5,
      "estimatedLearningCost": 2,
      "reusePotential": 2,
      "recommendedTopicType": "component_api",
      "title": "NCCalendar component API",
      "reasons": [
        "public component has no current published component knowledge unit"
      ],
      "retrievalCount": 0,
      "rawFallbackCount": 0,
      "snippetCount": 0,
      "taskCount": 0,
      "priorityScore": 30,
      "scoreBreakdown": {
        "taskHitFrequency": 0,
        "rawFallbackCount": 0,
        "publicApiImportance": 5,
        "reusableComponentCount": 2,
        "evidenceCompleteness": 5,
        "learningCostPenalty": 2,
        "unresolvedPenalty": 0,
        "lowConfidencePenalty": 0
      },
      "warnings": [
        "尚无任务级 demand 证据时，频率字段保持 0。"
      ],
      "dependencyCount": 3,
      "risk": 1
    },
    {
      "id": "gap-component-component-3cbb829be47ac290",
      "type": "uncovered_component_api",
      "targetId": "component-3cbb829be47ac290",
      "targetName": "NCWatermark component API",
      "packageId": "package-ncom-components",
      "currentKnowledgeIds": [],
      "reason": "public component has no current published component knowledge unit",
      "publicReachable": true,
      "documentationAvailable": true,
      "exampleAvailable": true,
      "structuralImportance": 2,
      "evidenceAvailability": 5,
      "estimatedLearningCost": 2,
      "reusePotential": 2,
      "recommendedTopicType": "component_api",
      "title": "NCWatermark component API",
      "reasons": [
        "public component has no current published component knowledge unit"
      ],
      "retrievalCount": 0,
      "rawFallbackCount": 0,
      "snippetCount": 0,
      "taskCount": 0,
      "priorityScore": 30,
      "scoreBreakdown": {
        "taskHitFrequency": 0,
        "rawFallbackCount": 0,
        "publicApiImportance": 5,
        "reusableComponentCount": 2,
        "evidenceCompleteness": 5,
        "learningCostPenalty": 2,
        "unresolvedPenalty": 0,
        "lowConfidencePenalty": 0
      },
      "warnings": [
        "尚无任务级 demand 证据时，频率字段保持 0。"
      ],
      "dependencyCount": 2,
      "risk": 1
    },
    {
      "id": "gap-component-component-4311e7da3e44f9af",
      "type": "uncovered_component_api",
      "targetId": "component-4311e7da3e44f9af",
      "targetName": "NCLoading component API",
      "packageId": "package-ncom-components",
      "currentKnowledgeIds": [],
      "reason": "public component has no current published component knowledge unit",
      "publicReachable": true,
      "documentationAvailable": true,
      "exampleAvailable": true,
      "structuralImportance": 2,
      "evidenceAvailability": 5,
      "estimatedLearningCost": 2,
      "reusePotential": 1,
      "recommendedTopicType": "component_api",
      "title": "NCLoading component API",
      "reasons": [
        "public component has no current published component knowledge unit"
      ],
      "retrievalCount": 0,
      "rawFallbackCount": 0,
      "snippetCount": 0,
      "taskCount": 0,
      "priorityScore": 28,
      "scoreBreakdown": {
        "taskHitFrequency": 0,
        "rawFallbackCount": 0,
        "publicApiImportance": 5,
        "reusableComponentCount": 1,
        "evidenceCompleteness": 5,
        "learningCostPenalty": 2,
        "unresolvedPenalty": 0,
        "lowConfidencePenalty": 0
      },
      "warnings": [
        "尚无任务级 demand 证据时，频率字段保持 0。"
      ],
      "dependencyCount": 2,
      "risk": 1
    },
    {
      "id": "gap-component-component-4b9e9229e841370f",
      "type": "uncovered_component_api",
      "targetId": "component-4b9e9229e841370f",
      "targetName": "NCDivider component API",
      "packageId": "package-ncom-components",
      "currentKnowledgeIds": [],
      "reason": "public component has no current published component knowledge unit",
      "publicReachable": true,
      "documentationAvailable": true,
      "exampleAvailable": true,
      "structuralImportance": 2,
      "evidenceAvailability": 5,
      "estimatedLearningCost": 2,
      "reusePotential": 2,
      "recommendedTopicType": "component_api",
      "title": "NCDivider component API",
      "reasons": [
        "public component has no current published component knowledge unit"
      ],
      "retrievalCount": 0,
      "rawFallbackCount": 0,
      "snippetCount": 0,
      "taskCount": 0,
      "priorityScore": 30,
      "scoreBreakdown": {
        "taskHitFrequency": 0,
        "rawFallbackCount": 0,
        "publicApiImportance": 5,
        "reusableComponentCount": 2,
        "evidenceCompleteness": 5,
        "learningCostPenalty": 2,
        "unresolvedPenalty": 0,
        "lowConfidencePenalty": 0
      },
      "warnings": [
        "尚无任务级 demand 证据时，频率字段保持 0。"
      ],
      "dependencyCount": 2,
      "risk": 1
    },
    {
      "id": "gap-component-component-5569bcc4a06f7f4b",
      "type": "uncovered_component_api",
      "targetId": "component-5569bcc4a06f7f4b",
      "targetName": "NCPagination component API",
      "packageId": "package-ncom-components",
      "currentKnowledgeIds": [],
      "reason": "public component has no current published component knowledge unit",
      "publicReachable": true,
      "documentationAvailable": true,
      "exampleAvailable": true,
      "structuralImportance": 3,
      "evidenceAvailability": 5,
      "estimatedLearningCost": 2,
      "reusePotential": 2,
      "recommendedTopicType": "component_api",
      "title": "NCPagination component API",
      "reasons": [
        "public component has no current published component knowledge unit"
      ],
      "retrievalCount": 0,
      "rawFallbackCount": 0,
      "snippetCount": 0,
      "taskCount": 0,
      "priorityScore": 30,
      "scoreBreakdown": {
        "taskHitFrequency": 0,
        "rawFallbackCount": 0,
        "publicApiImportance": 5,
        "reusableComponentCount": 2,
        "evidenceCompleteness": 5,
        "learningCostPenalty": 2,
        "unresolvedPenalty": 0,
        "lowConfidencePenalty": 0
      },
      "warnings": [
        "尚无任务级 demand 证据时，频率字段保持 0。"
      ],
      "dependencyCount": 3,
      "risk": 1
    },
    {
      "id": "gap-component-component-67803aa18e4c7439",
      "type": "uncovered_component_api",
      "targetId": "component-67803aa18e4c7439",
      "targetName": "NCComplextTable component API",
      "packageId": "package-ncom-components",